No.,Tweet,Label,Words,Notes,Contributor
1,Post-farmers market ice cream run. Did I choose the Blue Moon to turn my tongue blue? Maybe. 🌚 👅 #icecream #madisoneats #hurrybeforeitmelts #turnyourtongueblue https://t.co/LzooKVcTJB https://t.co/ZKG33E8tNa,environment,ice cream,,
2,"Wicker Park Farmers Market, 8 a.m.- 2 p.m. Sundays through late October @ Wicker Park Farmers Market https://t.co/oVCzovzuVh",NR,through,"business (time, location)",farmers
3,I checked in at Fresh Thyme Farmers Market on #Yelp https://t.co/sHKCyq9xnH,NR,checked in,,consumers
4,The June 30 market will be the last week for strawberries! Get them while you can and freeze them. 🍓🍓🍓🍓🍓 https://t.co/brYisOxLUq,NR,"last, stawberries! Get, you",,
5,"News from Discover Arlington: Mayoral Challenge SALUTE Run, Arbor Day, Spring Cleaning, Rock with Cops, Farmers Market: Upcoming events promoted by Discover Arlington include Just Move It 5K Run/1 Mile Walk at South Middle School, Arbor Day at Raven… https://t.co/X92S2Cg5VK",environment,"news, upcoming events",,promotors
6,Make nineteen pounds of pie dough for a wedding Saturday. Check! #fivefelinefarm #womeninbusiness #writer #foodie #farmersmarket #smallbusiness #baker #homemade #wegotthis #wegotthis💪 @… https://t.co/7mGmVLwkHL,NR,Check!,business (content),
7,big facts RT @_Thepromiser: Farmers market on a Sunday is a top 3 date. No debate needed,environment,"date, top, no debate",,
8,"Thursday Farmers Market in West Town lands $395,000 to help shoppers get more for what they spend https://t.co/vrdq0ESxnN https://t.co/f1MggJfZSr",availability,"$, get more, spend",,
9,#FitnessTip: Pay a visit to your local #FarmersMarket to enjoy richer and more #nutritious produce. https://t.co/l0UhCybE41 https://t.co/31gKsNdjnf,quality,"richer, more #nutritious",,
10,"You can find Presto Pesto at the Tractor Supply Farmers Market, 1185 Kings Highway in Port Charlotte on Monday, 7/2 and Tuesday, 7/3 from 9am-2pm!!! Celebrate the 4th Of July with Gluten Free Presto Pesto Pizzas and Presto Pesto 🇺🇲️",NR,you can find,"business (time, location)",farmers
11,Thursday’s are for farmers market and I get my Amish made croissant....#PregnantLadyproblems,NR,"for farmers marekt, I get, made",,consumers
12,"Do you know any local musicians who want to perform at a farmers market? Low-Line Market is looking for all types of artists to perform this summer. Email LowLineMarket@LakeviewChamber.com for more information! 

📸: @PhotosByGarbot https://t.co/L68MZgy0dd",environment,"musicians, artists, perform",,
13,Students from Elk Grove visiting the C-SPAN bus at Trickster Gallery in Schaumburg!  Come check it out and grab some fresh veggies at the farmers market!  @ComcastILLINOIS https://t.co/SFHKoimy3x,environment,"Students, come check it out, grab, veggies!",,
14,Chicago’s Best Farmers Markets: Our House Pizza – Chicago Video https://t.co/ciyxRUayVG https://t.co/ZQlzv87sdq,quality,best farmers markets,,
15,Large crowd at new Gurnee farmers market sows hope for business east of Route 41 https://t.co/S01nVUvCTD,environment,"large crowd, sows hope",,
16,"FARMERS MARKET TODAY! The West Town Health Market is back every Thursday from 3-7 at Presence Saints Mary and Elizabeth Medical Center, near Division and Oakley. Stock up on veggies, fruit, honey, meat, eggs, and more.  Triple Value Matching on all LINK transactions up to $15. https://t.co/hoti6dxPLX",availability,"beggies, fruit, honey, meat, eggs, and more","business (time, location)",farmers
17,Farmers Market @ St. John's Episcopal Church Aug 15 at 3:00 pm https://t.co/1OssZPEkOw via @PNdaily,NR,Farmer market @,,consumers
18,Interns on 🔥 at the @Ravenswood_Chi #FarmersMarket https://t.co/n8ntOFlfdC,environment,interns,,
19,"My Saturday so far: Watching soccer, shopping at a farmers market, and having my hair in a tail. The only way I could get more European is if this country had socialized medicine and a sane environmental policy #WorldCup",environment,"shopping, environmental ",,
20,Only 2 more markets left this season! Help the Illinois Stewardship Alliance with attendance counts at the Old Capitol Farmers Market  https://t.co/aqa5xOwCAU https://t.co/cReLRERsg1,NR,"Help, only, left, this season,",,promotoers
21,"Old Capitol Farmers Market. Chef from with Sean Keeley. Toasted bagels, salmon cream cheese, chives. https://t.co/jzADvPZQNT",availability,chives,,
22,You're invited: Lincoln Square Farmers Markets https://t.co/YPzGlqvojS,NR,You are invited!,business (content),
23,"Planning to #VisitOakPark this summer? You'll find historic walking tours, renowned farmers markets, unique street festivals, outdoor theater, and much more: https://t.co/ebpmZbMSwN https://t.co/ytoBdj2W1I",environment,"planning, vist, renowned",,
24,Thankful to be a guest judge for Heart of Illinois Professional Chefs Association Chopped Competition! — at Peoria Riverfront Farmers Market https://t.co/wjU0MvIrhn,environment,"thankful, competition",,
25,Farmers' Market Volunteers Needed: https://t.co/ug3EInDFmM #VolunTweet,environment,vonlunteers,,
26,"I don’t always have a chance to grab fresh food from the grocery or farmers market when I’m traveling, but I know I can always grab a @risebar for a healthy snack on the go! With a 4+ hr… https://t.co/xW5j4vYK0U",quality,fresh food,,
27,"Eco-friendly and chic.
https://t.co/3JRa5naZv6",environment,"friendly, chic",,
28,Some awesome food for thought from @AMReese07 as we start (hopefully?) the farmers' market season: https://t.co/md6ERrFopl,quality,aswsome food,,
29,"Farmers Market season is here! Visit us at a local market near you! We’ll be participating in over 15 markets this summer in every part of town - from downtown to southside, westside and northside of Chicago.... https://t.co/yvdh2HvtIb",NR,"visit us, you, season!",business (content),
30,Ravenswood Farmers Market  https://t.co/ML0VSrpDBR,NR,,business (content),
31,"Sunday June 10 - 1099 String Quartet, Farmers Market, Park Garden Tour https://t.co/ZgAfcM78VC",NR,,business (content),
32,Kankakee's Farmers Market is my happy place🌞,environment,happy place,,
33,Honestly the world should be just like one giant farmers market then everything would work out okay,environment,work out okay,,
34,Here’s the line up for today’s Farmers Market! 9am-1pm at Central & Hiawatha https://t.co/gHjfaGRqNF,NR,"here's, today's farmers market!",business (content),
35,Farmers Market's Proximity Marketing Solutions for booth!: https://t.co/TpWds7gvVh via @YouTube,NR,marketing,business (content),
36,Join us this Saturday at the Northcenter Farmers Market 🎵  - https://t.co/sQJYwgImps,NR,join us this Saturday at ,business (content),
37,"Sunday, August 26th, we will be at Frankfort Country Farmers Market in Frankfort, IL. 9am-2pm! Hope we see you there! https://t.co/JiBBNJQonf",NR,"we will, hope, see you there!",business (content),
38,Summer Sounds and Farmers' Markets Returning https://t.co/AvqckbaQC3,NR,returning,business (content),
39,"i had to make room in the refrigerator for all the produce i will buy at tomorrow's #farmersmarket, so here is an essential #mustgomeal #tagine style:
#roastedokra, #paddypans,… https://t.co/vAhaaT4R3K",NR,,desire to visit,consumers
40,This afternoon's adventures at the farmers market https://t.co/puECjdm9an,environment,adventures,,
41,"As #farmersmarket season approaches, our #dietitian shares what produce to get when this season: https://t.co/g2LetV3jZp #HealthTip https://t.co/fOYWEAEEoG",quality,dietitian,,
42,Skokie Farmers' Market - The Core of the Community https://t.co/E64Z48sqB0  @DowntownSkokie @NorthShoreWeb,NR,,business (content),
43,"This week's #bouquet from https://t.co/a5evCvsgd3 
#farmersmarket #flowers @61market https://t.co/c0YuE0kZaG",NR,"bouquest, flowers",business (content),
44,Old Capitol Farmers Market Celebrates National Farmers Market Week August 5-11 https://t.co/aPPIwdSO6r https://t.co/1CO8LnmsEm,environment,celebrates,business (content),
45,We're here at the #IllinoisProductsFarmersMarket giving away Springfield Clinic strainers (while supplies last). Come out and get your fresh produce and Illinois products. The market is open from now until 7 p.m. at the #IllinoisStateFairgrounds. #farmersmarket #springfield https://t.co/v9O4YbcMrQ,NR,"we're here at, come out and get your, fresh produce",business (content),
46,Roselyn  is sharing spare bushels. Grab one now! https://t.co/T8Q1Mqj9fk,NR,"sharing, grab now!",business (content),
47,Want to find out more about buying a house?  Check in with Veronica from NHS of Chicago every Friday afternoon at the IMAN—Chicago + ATL Farmers Market on 63rd ST. just east of California.  Reach Veronica at vgalvan@nhschicago.org.,NR,check in ,business (content),
48,"I might go to @TheCBsMusic at Evanston Farmers' Market in Evanston, IL - Oct 14 https://t.co/LkbBwgkitn",NR,,desire to visit,consumers
49,"“If you’ve got good produce a lot of customers are going to follow you.”
See how the Stephenson County Farmers Market is doing in its new downtown location. https://t.co/YePwIPRDXp https://t.co/ia0hboG6Bb",quality,good produce,business (content),
50,">> It’s National Farmers Market Week << by Faith Graphix - Printing You Can Trust on Thursday, August 9. https://t.co/ZONqdZWdcE",NR,,,promotors
51,Pellston Elementary School hosts back-to-school farmers market pop-up https://t.co/rLdcZSh4bG #backtoschool #farmersmarket #farmersmarkets #foodservice https://t.co/C218ekOzmq,environment,school,,
52,"I made it to 2 farmers markets (Horner & Independence Park), 3 festivals (Printers Row, Ribfest, Blues Fest), 3 bars this weekend. not bad considering weather/mood/etc.",NR,,visiting,consumers 
53,"This supports the Marengo fireworks. Come out to the farmers market today to buy tickets for $10 each, or go to the fire department to buy your tickets. This event is June 22. Hope some friends can make it! https://t.co/QNXzunI6rn",environment,"supports, fireworks, tickets, event, friends",,
54,"Thursday Farmers Market In West Town Lands $395,000 To Help Shoppers Get More For What They Spend https://t.co/iBFCllZa87 https://t.co/u7T1eRPhYy",availability,spend,,
55,PrairiErth Farm is having a stock up sale at the September 22nd Farmers' Market. Join us tomorrow morning from 7:30 a.m. to noon around the Museum Square. https://t.co/q1CodztzoZ,NR,join us tomorrow,business (content),
56,Feeling my farmers market fantasy https://t.co/0EpXANf0ZS,environment,"feeling, fantasy",,
57,"Is a tart a pie? 
This “very controversial” question plagued judges at last year’s Oak Park Farmers Market Pie Bake-Off, according to Melissa Elsmo, the queen of cuisine behind Oak Park Eats, who served as a judge in last year’s contest. https://t.co/pqIH5KJ0WO",NR,,,
58,"Spruce up your #summercuisine with this strawberry #salsa recipe from Janie Maxwell of the @ILFarmersMkts . This recipe works best with ultra-fresh, locally-sourced produce. Try looking into your local farmers market: https://t.co/0O7R1xbfef",quality,"strawberry, ultra-fresh, locally-sourced produce",,
59,"#sousvide #tritip dinner. All #farmersmarket all day. #cheflife #foodporn #beef @ Chicago, Illinois https://t.co/Z1Gb02rxrf",NR,,,
60,"#FoodieEllie reads Eat Well (her choice as we drove there) experiences #Champaign farmers market today. Menu collards, okra with tomatoes 🍅, corn on the cob, bruschetta selections with fresh basil, and grill squash. #foodie #farmfun #foody #4chionstyle #fourthofjuly #family https://t.co/WQpJOdUG7h",availability,"okra, tomato, corn, fresh basil, grill squash",,
61,"The SOAR Farmers Market is now open. This weekly market runs every Tuesday through October from 7:00 am - 2:00 pm at the MCA Plaza (220 E. Chicago Ave.). Be sure to say hello to our 2nd Ward volunteers if you visit the market to pick up some fresh produce, flowers or baked goods.",NR,"now open, if you visit",business (content),
62,Soap as far as your eye can see 👓. #soapjunkii #chicagievents #chicagofarmersmarkets #handmadechicago #chicagocitymarkets @ Lincoln Park Farmers Market https://t.co/Mc8b9ps3TR,NR,,,
63,"HOW PROXIMITY MARKETING CAN HELP YOUR BUSINESS AT FARMERS MARKETS, CRAFT FAIRS AND FESTIVALS #askdrmemo #mobilemarketing #craftfair @askdrmemo https://t.co/uoGVvWRptm",NR,,marketing,educators
64,"#Gardening allows an #athlete to grow their own #fresh produce, often in a wider variety than can be found in stores and markets. Not interested? Start looking for farmers markets near you! https://t.co/FNKCLSvnMn",quality,"start looking for, found, fresh",,promotors
65,"New farmers' market for us this year. All of you north-siders, come check us out at the Deerfield Farmers' Market! Every Saturday from 7-12. #coffee #deerfield #farmersmarket https://t.co/HFsszDOIWy",NR,new ,business (content),
66,Come see our midwestarkoftaste set up at the @61market !  Learn about our mission and how u can help. @Plantsrule1 #localfoods #sustanability #biodiversity @ 61st Street Farmers Market https://t.co/iVws6vn7H5,NR,"come see our, set up",business (content),
67,The Best Chicago Farmers Markets https://t.co/Mc4JzZmNP1 on @bloglovin,quality,best,,
68,Fall. It’s here. #farmersmarket #gourds #pumpkins #fall #myfavoriteseason  #watchmommabreathe #forwardisapace #tutulady @ Park Ridge Farmers Market https://t.co/Vydw5Uq8Cy,NR,,,
69,"More new items today: Tomato pie with roasted garlic, basil and Fontina. Cherry Custard Pie. Fresh Apricot Muffins. Horner Park Farmers Market and Glenwood Sunday Market.",availability,"more new items, tomato, basil, cherry, fresh apricot",,
70,I added a video to a @YouTube playlist https://t.co/IrrzDsTR25 Farmers Market Fritatta,NR,,,
71,What a beautiful day for a Bubble Tub! Farmers Market in the taproom today… https://t.co/B6JN0OaEZd,environment,beautiful,,
72,"THURSDAY! Check out The Cookout on Wheels & Kona Ice North Plainfield at @AloftHotels in #Bolingbrook! 

Then, head across the street to the Farmers' Market and 🆓️ Outdoor Summer Concert (at 7pm) at The Promenade Bolingbrook (@ShopPromenade)!

Event: https://t.co/e7UpIrq0sE",NR,Check out!,business (content),
73,Vanity Fair magazine highlights one of our very own: Joshua Tilden and chef Erling Wu-Bower introduce “a farmers market-obsessed restaurant with all sorts of California soul” with the upcoming Pacific Standard Time Chicago in River North. 🙌🏾🔥 https://t.co/BSuAyVzril,NR,"soul, upcoming",business (content),
74,"Now's a great time for farmers' market vendors to explore business banking options. What better place than at Prospect Bank, where our business and staff are a part of the community? Member FDIC and Equal Housing Lender. https://t.co/maD8sKHik8 #supportlocal https://t.co/gMViCTcrPn",NR,,,promotors
75,"I just signed up to participate and invite others to join me at the  @WhenWeAllVote event in #Chicago Sunday!

McKinley Park Farmers Market
3705 South Archer Ave
Chicago, IL 60609

Thanks @MichelleObama for the invite! #WhenWeAllVote 
https://t.co/bb0ehI68UY",NR,"sign up, join me at",desire to visit,consumers
76,Need a quick and easy dessert to go with your fresh strawberries from the farmers market? Here you go! https://t.co/w1FLyYXLky,quality,fresh strawberries,,
77,Music in the park. @ Ottawa's Old Town  Farmers Market https://t.co/FlSGROxW25,environment,music,,
78,"Spring produce is finally in-season! Here’s a tasty recipe for asparagus and mushroom frittata from Janie Alexander Maxwell, executive director of the Illinois Farmers Market Association. Try making this dish... https://t.co/5vrbIGMVAx",availability,"tasty, asparagus, mushroom",,
79,"Fresh fruits and vegetables are yours for the asking. The Downtown Hyde Park Farmers Market every Thursday 7:00am - 1:00pm
#downtownhydepark #hpcc",NR,"yours asking, ",business (content),
80,I wanna go to the farmers market on Saturdays and church in Sunday’s ya feel,NR,feel,desire to visit,consumers
81,Open Every Sunday Starting June 3rd: Downtown Skokie's fabulous Farmer's market returns to open at 7:30AM! @DowntownSkokie #SkokieIL https://t.co/I1LapkQfku https://t.co/HjsqWIoZe7,NR,"open, returns",business (content),
82,"Our #Islington Farmers Market is going from strength to strength.

This weekend we will welcome our latest addition to the line up - 💖 Lele's 💖

Their Bakewell Tarts are *to die for* and their #vegan sausage rolls are something else.

Come say hi bet… https://t.co/UgWzgFfYsq",environment,"welcome, latest addition",business (content),manager
83,Ok fine I'll say what everyone is thinking: that farmers market looks really nice https://t.co/gZDbad3Lwc,environment,looks really nice,,
84,"We are still accepting applications for pop-up vendors at our Farmers Market! Email ralph@edgewater.org for dates, details and pricing.",NR,,,
85,An article about the Chamber featuring information about the upcoming 2018 Season of the MGFM (Morton Grove Farmers' Market)... https://t.co/uAnhamEj1a,NR,"upcoming season, featuring information",business (content),
86,just saw a big fake booty at the logan square farmers market,NR,,,
87,Looks like a picture-perfect summer day in Chicago shaping up! What's on your 'to-do' list? #Errands #FarmersMarket #AntiqueScrounging #AlterationsPickup https://t.co/RE5G2uWEBw,NR,"looks like, perfect",business (content),
88,Upcoming Event: La Salle Farmers Market - 6/5/2018  https://t.co/Bg1g8v6vNw,NR,uncoming event,business (content),
89,"With hundreds of smiling faces in attendance, Northbrook's farmers market opened for its 10th season on Wednesday: https://t.co/5gOr623Ncm @NorthbrookFarm1 https://t.co/aKUQrBuBhn",environment,"smiling faces, attendance opened",business (content),
90,Soulard Farmers Market on #Yelp: Steve's produce https://t.co/ppDQEKXKEe,NR,,business (content),
91,Great day for the farmers market ☀️ https://t.co/X9bLsed0Ej,environment,great day,,
92,"While the chef was at market, early this morning. the baker was busy baking away. Farmers Market today in  quad 10am-1:30pm #BenUDining https://t.co/xC7KlbhUJa",NR,,business (content),
93,"Went to the farmers market alone ✔️
Got an all natural lemonade ✔️
Pet 3 Shih-Tzus ✔️
So far a grade A day ✔️",quality,"pet, natural, lemondade",,
94,"Join Chris our Hort Educator tomorrow morning from 8:45 - Noon at the Macomb Farmers Market. He will have some fun activities and take a ways, all about Monarch Butterflies! https://t.co/n19UUKKVZE",NR,,business (content),
95,Take notice... https://t.co/1nFCwTaI1I https://t.co/IPXdmqcLyR,NR,,,
96,Beet Box Mobile Farmers Market Makes Fresh Produce Accessible and Affordable https://t.co/qb3SP1SPBT,NR,"accessible, affordable",business (content),
97,Join @socialcollageme #divisionstreetfarmersmarket #chicagosoapmaker #chicagofarmersmarket #chicagocitymarkets @ Division Street Farmers Market https://t.co/sdpKkxtjzf,NR,,business (content),
98,The Glenview Farmers Market — now with fresh eggs from Historic Wagner Farms— kicks off its 30th year https://t.co/080WzcSToJ https://t.co/mIWe8chH2c,NR,,business (content),
99,Go to your local farmers market to get healthier fruits and veggies - https://t.co/24uFg0EbvA https://t.co/jlCLSYrp7c,quality,healthir fruits and veggies,business (content),
100,I checked in at Daley Plaza Farmers Market on #Yelp https://t.co/YPBb120qHG,NR,checked in,visiting,consumers 
101,Winfield Farmers Market!!! Come on out and taste BLISS!!!! https://t.co/amLN6p1fJz,NR,come on and taste!!,business (content),
102,"@turnip2020
I met some of your friends today at the farmers market😂😂😂 https://t.co/X6A3I4Ibl2",environment,,visiting,consumers 
103,"Aurora has one of the oldest farmers markets in the state, and it opens Saturday at the Aurora Transportation Center from 8 a.m. until noon. It will operate rain or shine each Saturday through Oct. 20. 
https://t.co/FwqGwTz2K5 https://t.co/5Ov4vRdVDl",NR,"opens, operate",business (content),
104,"[Quakertown, Pennsylvania -- Red Cross blood drive June 24] 
Quakertown Farmers Market welcoming four new vendors in June https://t.co/CPz5Dfpwce https://t.co/5puk8RZaen",NR,vendors,business (content),
105,"A3, gardening, farmers markets. #AgBookClub",NR,,,
106,Stop out and see us at the Orland Market in the Park!! It’s a beautiful night for some ICE CREAM!! — at Orland Park Farmers' Market https://t.co/q7mQJctYVd,NR,stop out and see us,business (content),
107,"Winnetka Farmers' Market TOMORROW, July 28.
510 Green Bay Road 
7:30 am- 12:30 pm",NR,,business (content),
108,"Tea of the week! Mermaid's Touch, find it at https://t.co/a8CouPe1wB #bettinastea #tea #icedtea #frenchmarket #farmersmarket #hibiscus #rooibos #greentea #blacktea #whitetea #oolong #matcha #detox #spring #summer2018 #ayurvedic #chaitea #herbaltea #fruittea #lombard #naperville https://t.co/CgNozXAUWK",NR,,business (content),
109,"I made a farmers market brunch today: fresh eggs baked with yellow tomato-red chile sauce, topped with basil & Parmesan.  Hot blueberry muffins. https://t.co/D7LtxUT20b",quality,"fresh, tomato, basil, bluberry",,
110,Today only due to Skokie's Backlot Bash the Skokie Farmers' Market is moving to the WEST parking lot of the Skokie Public Library. https://t.co/5B7FzC9gTU,NR,moving,business (content),
111,Thursday farmers market season Daley plaza opening #farmersmarket #chicagoIL #freshproduce #Greens,NR,opening,business (content),
112,First Bank &Trust community shredding event at Downtown Farmers Market (east side) 9-11 a.m. on May 12. Four shopping paper bags (25 lb.) max.,NR,,business (content),promotors
113,Central Park Farmers Market | Just another https://t.co/tbTHzjqlEF site https://t.co/ZSRTmWNJbw,NR,,business (content),
114,Our haul from the farmers’ market. We went in looking for pieces to put together a charcuterie board for tomorrow night and I think we nailed it. https://t.co/4IYfQCbROf,NR,"looking for, tomorrow night (time)",business (content),
115,Join us for our Farmers Market Tour and Cooking Class this Thursday at Lincoln Square. You'll meet the farmers and vendors at the market then enjoy an impromptu cooking class made with the bounty! https://t.co/iSTZA7yUZ0 https://t.co/N92EJ9cEIZ,NR,"join us, you'll meet, enjoy",business (content),
116,Wow Organic Garlic Old State Capitol Farmers Market  https://t.co/8BUE1Pfuch,quality,organic garlic,,
117,"Every time I google ""how to get x stain out of x"" it's like 
TAKE 10 GALLONS OF LAUNDRY DETERGENT AND MIX IT WITH A TUB OF IODIZED WATER AND 10 TABLE SPOONS OF SALT PLUS ARTISAN SPECIFIC VINEGAR FROM THE FARMERS MARKET 
and that's why I have stains on all my shit",NR,,,
118,"Free Tulips For Mothers Day, May 13 2018 @ Logan Square Farmers Market Outdoor Site, https://t.co/l3nQ6h0DYU #Community #Featured",NR,,business (content),promotors
119,Or the @thekapman ‘s farmers market….,NR,,,
120,Winter European Farmers Market and Love Local sampling event happening Saturday 10am-2pm. Come… https://t.co/1eVVkwNIMj,NR,"happening, come",business (content),
121,"Farmers Market Sunday 💚🌿 #felicity #candydelight #sundayfunday #farmersmarket #logansquare #chicago @ Chicago, Illinois https://t.co/cfXbSUcypk",NR,Sunday,business (content),
122,"just a lil reminder to slow down and enjoy these last weeks of summer! ✨ take a trip to the farmers market, go on a long walk, fire up the grill, drink a cold one. they go so, so fast. fall can wait. soak it UP! ☀️🍅🌽🍆🥦🥗🍺🤸🏻‍♂️ #howisummer https://t.co/jHeEG5pzRo https://t.co/GmVMeDh4lt",NR,last weeks of summer!,business (content),
123,"15lbs of rhubarb from Gray Farms, @ToddAppel making rhubarb lemon cordial! (@ Andersonville Farmers Market - @ecoaville in Chicago, IL) https://t.co/KpzVHD9GfH https://t.co/WuPGOOsjmy",availability,"from farms, rhubarb (15 lbs-weight)",,
124,"Hey farmer friends! I'm teaching a free webinar all about farmers market success, thanks to The Land Connection! 

Just sign up and see my do my first ever webinar! https://t.co/65kXe4l6FF",NR,"teaching, sign up and see, free",business (content),educators
125,"A 👉FREE Market Bag👈 for the FIRST 100 customers at the Everyday Edgebrook Farmers Market this Saturday, 8/4, 9am - 1pm!!!  

Located in Edgebrook school parking lot
6525 N Hiawatha Ave https://t.co/ybpR89FEV6",NR,"FREE, this Saturday",business (content),
126,The farmers market in Kansas City though 😍👏🏽,NR,(emoji - good),visiting,consumers
127,"Start your day the Beaver Way and check out the trucks at Southport & Addison, and at the North Park Farmers Market! #coffee #minidonuts #donuts #foodtruck https://t.co/6UJa6MQHbJ",NR,start your day,business (content),
128,Visit your local #FarmersMarket to help out your local economy - https://t.co/N87xOwz5Ku https://t.co/NXxZ1IJrmM,NR,visit your local,business (content),
129,"The Thursday evening @LSRCC_Chicago #farmersmarket in #LincolnSquare kicks off tonight! Join us at our booth at 6pm for a demonstration on how to make Asparagus-Mushroom Crostini with Ricotta, Manchego and Honey using ingredients from local farmers and vendors. https://t.co/o5dLF6ON45",availability,"join us, asparagus-mushroom,",business (content),
130,"Farmers Market 3x’s a week...no excuse not to get healthy!
.
.
.
.
.
#gethealthy #healthyfood #healthyfoodhub #organicfruit #organicvegetables #wholefood #healthylifestyle #foodmarket… https://t.co/7CiLyJrsxc",NR,healthy,frequet visit,consumer
131,"Varieties Music Team has a show on 10/06/2018 at 09:00 AM @ Arlington Heights Farmers Market in Arlington Heights, IL https://t.co/DQQiz8iGVo #concert https://t.co/mazrUVwVeB",environment,music,,
132,"Deerfield’s Fresh Thyme Farmers Market is closing May 5, the victim of poor sales. https://t.co/i7ntIOU9HA https://t.co/nBoG4zk8eY",NR,closing May 5,business (content),
133,#FYI There you go... spinach! Farmers market report: Winter Bloomsdale spinach gives you a sweet reason to eat your greens https://t.co/YWpGdIa2g9,NR,"spinach, sweet, greens",business (content),
