No.,Tweet,Label,Words,Notes,Contributor
682,Farmers market in Davenport opens back up Saturday morning☀️☀️,NR,,Business,
683,"@JaneHirt I'll be at a farmers market tomorrow EARLY to make sure I get mine.🌽
I was shutout at Arlington Heights last Saturday. I'll drive up to the Harvard farmstand if I have to.😂",NR,,,
684,"Sun-soakin’ bulges in the shade (peaches), now available! 🍑! (@ Downtown Bloomington Farmers' Market in Bloomington, IL) https://t.co/QMGWD7FIQd https://t.co/z3XBkYJ258",NR,,Business,
685,Your opinion matters and we want your feedback! Please take a minute to share your thoughts on the Downtown Crystal Lake Farmers Market!  Open to ALL--including those that don't… https://t.co/6iO4YtABOy,NR,,,
686,"Mike McNeil, a legendary Farmers' Market artist,  has an art show opening tomorrow at Ryburn Place in Normal. Check it out! https://t.co/cEubTjLnwQ",NR,,Business,
687,"It's National Farmers Market Week and we are proud to have Cedillo's Fresh Produce growing at our Eat to Live Incubator Farm in Chicago. To support Eat to Live, and our other programs, join us at our Harvest Moon Dinner on 9/13! https://t.co/lO6e5mrZoP #nationalfarmersmarketweek https://t.co/2RKD3ECjZ9",NR,,Business,
688,Friday Night Concerts & Farmers Market Back on the Square for the Season https://t.co/fxjSic0gsH https://t.co/QemkHTSFaA,environment,concerts,,
689,I got to be a judge in the 2nd Annual Oak Park Farmer's Market Pie Bake-Off! I'm wearing the judge's ribbon for the rest of the day and will judge you all accordingly. #pie #OakPark @oakparkeats #farmersmarket  @OakPark https://t.co/MLMJy8qnCN,environment,"judge, bake-off",,
690,Good night 💤 Annie 💫 @txstarkeeper hope you sell everything at your Farmers Market🍐🧀 https://t.co/7teSXbPcpL,availability,"sell, everything",,
691,Lake Barrington farmers market returns https://t.co/tKX2yVYqA3,NR,,Business,
692,"I'm at Division Street Farmers Market in Chicago, IL https://t.co/pALuu8PW5q https://t.co/9atJdXUOSE",NR,,Business,
693,We are at the Fox Lake Farmers Market today til 8:00. Come try a slice of the wood fired pan pizza! https://t.co/li3MqVa6Op,NR,,Business,
694,I bought my yogamat for .002 bitcoin at the farmers market.,economics,bitcoin,,
695,PHOTOS: Woodstock Farmer's Market opens for season https://t.co/56bLYhg0K3 https://t.co/77hQrwN2UP,NR,,Business,
696,The Andersonville farmers market only exists for cruising,environment,cruising,,
697,Take advantage of your local #FarmersMarket to get healthier fruits and veggies - https://t.co/QOTFbeIy4T https://t.co/t55hDRBZSx,NR,,Business,
698,Roselyn wants to share some Amber Grain Bushels with you in FarmVille! https://t.co/pFVKa4WoPk,NR,,Business,
699,A baked potato thickens this corn soup and pickled jalapenos give it a spicy kick.  https://t.co/wPfDE7NBsV,NR,,,
700,Watch @elder_tina's broadcast: Homewood Farmers Market Address https://t.co/OlBQCO6gdg,NR,,,
701,"@SeattleEine @wisebread I've negotiated at flea markets before, but didn't know you can do that at farmers markets, thanks for the tip! #WBChat",economics,negotiated,,
702,"The 61st St. Farmer’s Market is indoors this Saturday, from 9am-2pm! Tour @10:30! @61market #diabetes #freshproduce 
https://t.co/E3qgZB352D",NR,,Business,
703,This Craft Nation has invaded! — at South Haven Farmers Market https://t.co/UFMWiu7T4n,NR,,Business,
704,Clarendon Hills Farmers Market on #Yelp: Sour cherries https://t.co/TxdtlONdsr,NR,,,
705,#HealthTip: Choose your local farmers market to help out your local economy. https://t.co/HSX72mziAC https://t.co/X06nFKtvve,NR,,Business,
706,Some food stamp recipients may soon lose access to farmers market benefits https://t.co/gGfNJEspjG,economics,"lose, benefits, stamps",,
707,Grayslake Farmers' Market Tour: https://t.co/SXJznbtpkO via @YouTube,NR,,Business,
708,#michigan asparagus @ opening day of #Chicago #FarmersMarket season #localfood https://t.co/BaPU89huUX,NR,,Business,
709,Woodstock Farmers Market Summer Market Opening Soon https://t.co/iakgi2udNT,NR,,Business,
710,Perfect weather for The Hyde Park Farmers Market! #GetFreshThurs https://t.co/glT8KRRcH9,NR,,Business,
711,.@BenUFO's cousin bout to rock this farmers market #b2b #dayparty https://t.co/3WrUZm6vYi,NR,,,
712,Again today at the awesome Ravenswood Farmers Market. Come for some refreshing cold brew and nitro. #blackfodder @ Ravenswood Farmers Market https://t.co/633LRvrSXX,NR,,Business,
713,#HealthTip: Visit your local #FarmersMarket to to be #healthy with fresher veggies. https://t.co/IiAI1BMdG7 https://t.co/BEA9eYAEHb,quality,"health, fresher",,
714,Opening day!! Come out to the parking lot next to First Baptist Church for the first day of the Main Street Farmers Market!!,NR,,Business,
715,Upcoming Event: Hinsdale Farmers Market 2018 Season - 7/9/2018  https://t.co/BeJBKEczrx,NR,,Business,
716,"Mike Felten has a show on 10/13/2018 at 10:00 AM @ Park Ridge Farmers Market in Park Ridge, IL https://t.co/Je9mpOTQ9X https://t.co/FXJ105SSSK",NR,,Business,
717,@plantchicago Farmers Market is underway.  Waffles anyone? @ Whiner Beer Company https://t.co/idK2JhBr5l,NR,,Business,
718,Village of Lake Barrington Farmers’ Market  Opens for 2018 Season https://t.co/98bEhK0fY7,NR,,Business,
719,"Stop by and see us at the Old Capitol Farmers Market! We are on the corner of Fourth and Adams streets. You can enter for a chance to win a NutriBULLET Pro, nine-piece set; two 24-oz. Tervis Tumblers; two Yeti... https://t.co/Ka4hBaagt2",NR,,Business,
720,"Tomorrow's Concert ""28 Days"" music starts at 7:30 pm at the William E. Brook Entertainment Center, 900 Skidmore, Antioch.
Don't forget about the Farmers Market, at the bandshell. 3:00 pm - 7:00 pm 
Come to the Market, Stay for the Music. https://t.co/gDJSsT4cXW",NR,,Business,
721,"Get on over to @Northcenter to visit their #farmersmarket! Find out more info in the StreetWise Farmer's Market Guide, OUT NOW! https://t.co/vEUisCnCXX",NR,,Business,
722,"Back in the Bay, cherries from the farmers market, Anchor steam and a clam chowder (not pictured)...what more do you need?.....a placement! https://t.co/CWF4pSpOqk",availability,cherries,,
723,"Farmers’ Market farmers know how to treat their animals. At the market, you’ll find meats, eggs, and cheeses that come from animals who have grazed on green grass and eaten natural diets. Animals who are free of... https://t.co/0Wwg7g7kfb",availability,"animals, meats, eggs, cheeses",,
724,"This Week’s Schedule:

Wednesday 3-7 pm Farmers Market at St. John's - Naperville, Illinois

Thursday 3-7 pm 95th Street #FarmersMarket - Naperville, Illinois @ Naperville Public Library’s 95th Street Branch... https://t.co/lvoB5e5TRO",NR,,business,
725,We’ll be in #downtownelginil this Friday at 5:30-7pm for the farmers market on Grove Ave. Come check it out! It’s gotten great reviews: https://t.co/7VXMumoU4q,NR,,business,
726,Today was an amazing showing for peace villages first ever farmers market!@mcl_katiekunkel @mcl_katiekunkel @bethebenchmark https://t.co/k178qWy0wf,environment,show,,
727,"We went to visit the Low-line farmers market this evening to see our friends @farinataproject and cookieyumchi   
.
We were hopeful to be able to participate in the market this summer too,… https://t.co/6NgHbGFPAR",environment,"visit, see friends",,
728,Farmers Market oh yaaaaas 🌻,NR,yaaaaas,,consummers
729,A couple more pics from last night at the Elgin Farmers Market.,NR,,,consummers
730,"The annual Friends of the Farmers' Market recruitment night is set for 7:30-8:30 pm next Tues., May 8 at @oakparklibrary. This informal orientation session is intended for anyone interested in volunteering/learning more about the #OakPark Farmers' Market. https://t.co/mIGxkAVIUZ https://t.co/SWVOUETOFz",environment,"volunteering, learning, recruitment, friends",,
731,Tune in to @WCIA3 this morning at 9 for Champaign Farmers Market updates from Sarah! https://t.co/xtll9F1zzp,NR,,,consummers
732,"Sometimes less is more, like with these sweet potatoes for theme 6 of the food photography challenge for @TLPlantation | I found these guys at the Andersonville farmers market and was… https://t.co/2fwniBXZL5",availability,sweet potatoes,,
733,"@EdClarkPiano  will be out at the Illinois Products Farmers' Market from 5-7 today.

https://t.co/yYcuuxcuxb https://t.co/o8J52RmREP",NR,,business,
734,We tried to get Louis in on the pic but he was busy in the bounce house. @ Soulard Farmers Market https://t.co/xo9RhbX6ea,NR,,,
735,@potatoislike Yo they always have em at the farmers market tho,NR,,,
736,"Read Wicker Park Farmers Market: Vendors, Transit, Parking https://t.co/unizgcxOLF #albanypark",convenience,"transit, parking",,
737,Stone soup served at farmers market to a long line of Oak Parkers. #dooper #doopers #stonesoup #traditional #oakparkeats @ Oak Park Farmer's Market https://t.co/m8sXVzEe5d,NR,served,business,
738,"The 2018 #FarmersMarket in @SchaumburgIL—featuring locally-produced fruits, vegetables, baked goods and more—will open Friday, June 1 and run every Friday through the end of October. https://t.co/iRBMmOxQce https://t.co/KWuejT0RDt",NR,"locally produced, fruits, vegetables",business,
739,Today's CSA box came with the deliciously rare 'U'cumber. #CSA #FarmersMarket https://t.co/FQ6PZJKlVK,availability,"deliciously, cumber",,
740,Why A Farmers Market? https://t.co/KInIndW5Yf https://t.co/dnl2S56EXb,NR,,,
741,I went to my first farmers market today and this is 100% true. So many good doggos today https://t.co/L82t183Shr,quality,true. ,,
742,Come check out our fall soaps this Saturday 8am-noon. At the @twincitymarket #naturalsoaps @ Twin City Farmers Market https://t.co/v9olkNImJu,NR,come check out this.,business,
743,"Christmas in July!
Join us today at the Huntley Farmers Market.
Small bags of large carrot treats are BOGO at the market only!

#allnaturaldogtreats #homemadedogtreats #craftbeer… https://t.co/KTYgsxPi2X",NR,"join us today at, carrot",business,
744,"I never knew this location existed until now. What a cute farmers market! #SundayFunday #MothersDay (@ Logan Square Farmers Market in Chicago, IL w/ @markprad) https://t.co/7JnTUAD1Wk",environment,cute,,
745,"Just missed dad and that baby smh (@ Beverly Farmers Market in Chicago, IL) https://t.co/zw4MhN0bqB",environment,"dad, baby",,
746,"@dblOneg @larry_earle @SenSanders Well, lucky you. Our farmers market is more expensive than the grocery store.",economics,more expensive,,
747,"I made farmers market brunch: German butterball potato pancakes, fried okra and frizzled eggs (browned butter & crispy sage) https://t.co/gULswCCQP0",availability,"potato, okra",,
748,".@EILEENFISHERNY is having a Fall Event on Saturday 9/15. Along with $30 OFF of $50 Coupon (SOME EXCLUSIONS APPLY), they will be hosting a mini Farmers Market with @wchproduce! They will be in the store from 10-12pm to help usher in #Fall. @chicagobotanic https://t.co/yxHTiGVreW",environment,"event, coupon",,
749,Farmers markets promote community in 2018 season: The Cabot Farmers’ Market is more than just a… https://t.co/c1Yv0msTSH https://t.co/Z01VAy5GoH,NR,,,
750,"peter_joffrion: RT FarmAid: It's #NationalFarmersMarketWeek and we're celebrating by sharing facts about how shopping at farmers markets can impact family farmers and your community as a whole.  👩‍🌾👨‍🌾

43% of farmers at farmers markets have been far… https://t.co/38NbnYddkz",environment,"community, family",,
751,"Today we celebrate #NationalFarmersDay, but frankly, the American Farmer and the farmers in the 2nd Illinois Congressional District should be celebrated every day. Thank a farmer today. You can start by shopping at one of the many Farmers' Markets throughout #IL2. https://t.co/lKsmGm5oB1",environment,celebrated,,
752,"This is just a reminder, there is NO FARMERS MARKET this week or next week. We will see you on Thursday, September 13th. https://t.co/n6W4uCpYeY",NR,"reminder, see you",business,
753,Upcoming Event: Huntley Farmers Market - 8/18/2018  https://t.co/1fV0RdNv8O,NR,upcoming event,business,
754,"Start your Saturday with a visit to the 61st Street #FarmersMarket, located at 61st/Dorchester. Open from 9am-2pm. #Woodlawn #HydeParkChicago https://t.co/ASIcTRCQrd",NR,"visit, located at",business,
755,"Brief rain and the sun's back out!  Here until 7pm today @avillechamber

#chicagosbest #vegan #tofu #tofusalads @ Andersonville Farmers Market https://t.co/pK91poamOO",NR,,,
756,Go to your local farmers market to enjoy richer and more nutritious produce - https://t.co/sKirZvZfiv https://t.co/JYYe94pqFo,NR,"richer, nutritious",business,
757,"Come on out to the Riverside Farmers' Market, say hello, grab some hot or cold coffee & check out all the amazing vendors. 

Every Wednesday 2:30-7PM
June 6 - Oct 10
10 Pine Avenue
(Centennial Plaza near the Historic Water Tower) @RiversdeFarmMkt #dripcoffee #pourover #coldbrew https://t.co/AHbxLht62S",environment,"amazing vendors, coffee",business,
758,"Oak Park-area volunteers are hitting the farmers market every week to build support for a 100% clean energy economy. Sign up  to help collect petitions at the Oak Park Farmers Market Saturdays through the end of September. #ReadyFor100

https://t.co/VV8mq0eg68",environment,"sign up, volunteers",,promotors
759,Daley Plaza Farmers Market on #Yelp: Someof my fresh produce finds at the market https://t.co/5IlJftD8ty,quality,fresh produce,,
760,"Today on the ""Illinois Town & Country Partners"" radio program we'll talk to the @IALCouncil about retirement readiness and with the Belleville Chamber of Commerce about farmers markets.  Listen on your local radio station or here: https://t.co/jHevax7HUO https://t.co/EZhNMbziLQ",NR,,,
761,"Lincoln Square Farmers Market - Cooking Demo, live music, food,drinks https://t.co/9wMiilXVo2",environment,"live music, cooking",,
762,@DoRiteDonuts @jesshimes - Good news! You can pre-order your @DoRiteDonuts. You don’t have to stalk the farmers markets for pop-up stands during work hours anymore.,convenience,pre-order,,promotors
763,RT One of the best features of a farmers market is being able to meet the people who grow your food and ask questions about their practices https://t.co/vqM7mNduWK,environment,"people, grow",,
764,@YokidsitsMaggie 12. Farmers markets are the source of all good and wholesome content in this world,quality,"source, good, wholesome",,
765,"@Itsmissmeghan Yeah, I never end up really ""sleeping in"" on my days off. Usually up by 6 or 7. Gonna try and remember the farmers market this Saturday though.",NR,,,
766,goal at farmers market= pet as many dogs as possible,environment,pet dogs,,
767,"Come dance with us at the Low Line Farmers Market in Lakeview tomorrow, Thursday, June 28, from 3:00-5:00! Wiggle, boogie and groove as we play dance games with families walking through. Head over to 3410 N Southport Ave at 3:00! https://t.co/JjjjEHEXWd",NR,,business,
768,Farmers Markets Growing In Illinois https://t.co/ucAAzlu42W,availability,growing,,
769,"Today marks the first Saturday of the Downtown Tinley Farmers Market! 

They're open from 7:30 AM to 12:30 PM. Pick from the best selection of fruits, vegetables and fresh flowers! https://t.co/zGlaSGMHfr",NR,,business,
770,It’s going to be a beautiful weekend. Stop by the Horner Park Farmers Market today and Glenwood Sunday Market tomorrow. Cherry hand pies and tomato pies are back as well as some new items. Next week plums and peaches make their seasonal debut!,availability,"stop by, cherry, tomato, plums, peaches",business,
771,"Tomorrow at The Hyde Park Farmers Market, celebrity chef Shirley J. Newsome will be serving up her famous grilled corn! You don't want to miss this! #GetFreshThurs https://t.co/IfoCrMVDa7",availability,corn,business,
772,#soapjunkii #chicagofarmersmarkets #thingstodochicago #soapmakingparty #chicagosoapmaker #birthdaypartychicago @ Division Street Farmers Market https://t.co/JfvbRk3abz,NR,,,
773,Come out to support our local farmers market. https://t.co/dLyoTWztDk,environment,"come out, support, local",,promotors
774,I liked a @YouTube video https://t.co/xLV75bOiCO Coco Peru goes to the farmers market.,NR,,,
775,Farmers Market Season Kicks Off in Chicago: See the Schedule https://t.co/IoELb7jRA8,NR,kicks off,business,
776,Come visit us at the DeKalb Farmers Market! Selling farm grown eggs and handmade bird houses. If you miss us this time we shall be back in August too!,NR,come visit us. ,business,
777,Get your reusable bags and your appetites ready -- the Farmers' Market opens this weekend!! https://t.co/4vzqirorPv,NR,,business,
778,lady @ sturgeon bay farmers market lit tried steal the bok choy I had in my hand.,availability,bok choy,,
779,Started my day in St. Louis with @whitecastle and soulardmarket #stl #stlouis with some of my favorite peep. @ Soulard Farmers Market https://t.co/fW93vlI4jY,NR,,,
780,Summertime = Heirloom Tomatoes. Thanks Jon First. Evanston Farmers Market🍅 @ Oceanique https://t.co/v07JeRBW0V,NR,,,
781,"Our Farmers Market is open! Join us Monday evenings through October 15 for fresh, local, sustainable goods. More details can be found here: https://t.co/VSWPE2UZWV https://t.co/wRCnOMaTLT",quality,"open, through, fresh local, sustainable",business,
782,The Downtown Farmers Market is open now on the square! #prairiepress https://t.co/5vetPAigKe,NR,open now,business,
783,@NonamePoetRubio the other was a farmers market on wheels. Everything in a produce section and cafeteria on wheels going from neighborhood to neighborhood 😂😂,environment,neighorhood,,
784,My first weekend as a part of the Artisan Collective Batavia at the Farmers' Market—3rd Saturdays - Come on buy and support local artists! https://t.co/jJH9dY8Rxj,environment,"collective, artists",,
785,Picked up some strawberries and asparagus at the Old Capital Farmers Market with Stella this morning. https://t.co/idA355jkU5,availability,"strawberries, asparagus",,
786,Saturday Morning at the Pleasantville Farmers Market  https://t.co/RpBX0gIU0d via @MoreTime2Travel https://t.co/cUJ3DGO23s,NR,,,
787,"Chantel will be in Michigan the second week of August performing solo at the Book Nook & Java Shop in Montague on August 10, and at the Muskegon Farmers Market the morning of August 11! If… https://t.co/EkHxyrgPjg",environment,permorming solo,,
788,A clear summer 2018 staple...Farmer's Markets! - See the complete list for #ChicagoNorthShore: https://t.co/GOP7tiopxI https://t.co/GOP7tiopxI,NR,,,
789,"Just a reminder, some of your favorite vendors may be in a different location tomorrow do to the GLT Summer Concert.  Be sure to check out the interactive map so you know where you need to go! https://t.co/6QA9hq7AEj",NR,"reminder, vendors, location, check out, map",business,
790,@PstafarianPrice @ChicagosMayor It's already a well used space. This is the Low-Line Farmers Market. https://t.co/RG3YEEqHpF,NR,,,
791,Happy #FarmersMarket Day! We’re here and ready for another successful year. We hope that you’re able to make it out today from now until 7 p.m. Stop by our table to get your “Healthy Recipes” card. This week’s recipe is Spring Lentil and Asparagus Tacos with Radish Sprouts. https://t.co/ArNjP7aw6M,NR,stop by our table,business,
792,"Today is HUNTLEY FARMERS MARKET & CRAFT FAIR at October 6, 2018 at 8:00 AM - 1:00 PM! https://t.co/LcNipm6sdY",NR,today is ,business,
793,"Little Me Play Studio will be hosting our Growing project from 9-11am on Saturday during the farmers market. Swing on by and see what they’re all about and have planned.  

Also, we will be taking sidewalk chalk donations!",environment,"donations, hosting, play studio",,
794,FARMERS MARKET: Naperville has three different farmers markets to choose from for those looking for fresh food and good fun. Here's the story: https://t.co/5GXr7vjScj,convenience,"three different, choose, looking for, fresh",,
795,"If you are a summer soup lover, this farmers' market Corn and Potato Soup is for you! https://t.co/TebdOYOZJy",availability,"corn, potato",,
796,"Tomorrow, @PhysicsIllinois is bringing Science at the Market: Pollinators to the Farmers Market at Lincoln Square mall in Urbana. Learn more: https://t.co/JPJAPxJBB9",NR,"science, pollinators",,educators
797,"The #WickerPark #FarmersMarket: Where tomatoes, peaches and petitions are in season. 
(The signature collectors I spotted were there for @RahmEmanuel). TIP: To be valid, #Chicago residents can only sign the petitions of ONE of the dozen candidates running for mayor. Just one! https://t.co/6zkauys8cA",politics,"tomatoes, peaches, petitions, candidates ,mayor",,
798,I checked in at Fresh Thyme Farmers Market on #Yelp https://t.co/sHKCyq9xnH,NR,checked in,,
799,If you are going to the Farmers Market please remember to park legally. See attached link for parking info. #evanstonfarmersmarket   https://t.co/Q1fvpVtMHj,convenience,park,,
800,Here's a tomato sauce recipe that you can make with all the tomatoes from your garden or the farmers market. https://t.co/qSfE6nTMMy,NR,tomato sauce,,
801,Join us tomorrow June 13th at Palos Heights Farmers Market! https://t.co/oIKAXdFTWL,NR,join us tomorrow,business,
802,I just couldn’t say away from Steph and more beir @ Soulard Farmers Market https://t.co/hPCgOn9UoU,NR,,,
803,Just spent $3 on a banana at the farmers market at LAX AMA,availability,banana spend $,,
804,Find us every Saturday at the Division St and the Lincoln Park #farmersmarket. #chicagodonuts https://t.co/eWjI8QvLXV,NR,find ut,business,
805,"Our friends from @BrewLimitless will be pulling up to our Sidewalk Farmers Market in Darien, this Saturday, with samples of cold brew coffee & their new lightly caffeinated sparkling water! Sip & shop from 12:30-3:30 😎 *Darien location only. 2141 W. 75th St https://t.co/wdSuFnP5LG",NR,,business,
806,Farmers Market @ St. John's Episcopal Church Tomorrow at 3:00 pm https://t.co/HWBGif1a9C via @PNdaily,NR,,business,
807,"HOW PROXIMITY MARKETING CAN HELP YOUR BUSINESS AT FARMERS MARKETS, CRAFT FAIRS AND FESTIVALS #askdrmemo #mobilemarketing #craftfair @askdrmemo https://t.co/uoGVvWRptm",NR,,,
808,"The Wicker Park Farmers Market kicks off today! Stop by and grab some bagels, cream cheese, and try @hotdougs Atomic Brobagel Dog available exclusively here. @WickerParkBuck https://t.co/IbzcTfHAUa",NR,"kicks off, stop by, grab some, available",business,
809,"The Historic Downtown Plainfield Farmers Market opens this Sunday, June 3 from noon to 4:00 PM! https://t.co/DUCWjfXwsv https://t.co/ha7bAPZhgP",NR,opens,business,
810,Andersonville Farmers Market - Week 16 - Last 8PM market! - https://t.co/xMgkJtKHKt https://t.co/tyhXQGqq4B,NR,last,business,
811,"PRESTO PESTO!!!Four for Four! FOUR Farmers Markets in FOUR days!! Ready, Set, GO!!!
Gluten Free Goodies for EVERYONE!!!
Come hungry! You wil be glad you did!!! 
Visit https://t.co/bLgvjrbGMm for our Farmers Market schedule https://t.co/zVWcHMF3Ns",NR,,business,
812,Our local Farmers Market Managing Organization (Pembroke Locally Grown) gives out a few egg laying chickens. Are yours! Except when the chicks becomes egg laying Hens. You have to give Locally Grown eggs or meat. This feeds local families.,environment,"feeds, local families",,
813,"Today's haul from the Redland Farmers Market in Deep South Dade County, plus a belly full of Mexican food and a strawberry-Key lime milkshake. https://t.co/ZdrT75jBhB",NR,,,
814,"@amosedale @slines @lawyer1mom @brendaslynn @Seaglass67 @NantucketGal @pacearly @ShiCooks @DoorHardwareLux @sandyconnolly @JLSchultheis A hard freeze last night. Off to farmers market with Hannah, coffee in hand.",environment,coffee,,
815,"Check out this week's enewsletter to find out what's happening at the August 4th Farmers' Market, https://t.co/uDUq9g4hxC https://t.co/uDUq9g4hxC",NR,check out,business,
816,We will be attending the Downtown Bloomington Farmers' Market tomorrow morning.  We had to miss many weeks and are looking forward to seeing everyone Saturday.  See you soon!,NR,"attending, looking forward to seeing",business,
817,"FARMERS MARKET TODAY 3-7! Restock your post-holiday supply of fresh fruit, veggies and lots more at the West Town Health Market near Division and Oakley. Triple Value Matching on all LINK transactions (up to $15). *In case of bad weather, the market will move to the NFC Gym.* https://t.co/EwpqvLFZlf",NR,"today, beggies",business,
818,Sunday morning at the Portage Park Farmers Market https://t.co/qlAwqfnT4t,NR,,,
819,"To ensure our guests have the freshest produce, we partner with local #Chicagoland farms and farmers markets to source our vegetables. Where's your favorite farmers market? 

#hearthrestaurant #evanston #healthyliving https://t.co/Lx8qv7eREh",quality,"source, freshest produce, begetables",,
820,"FARMERS MARKET TODAY! West Town Health Market is open every Thursday from 3-7 at Division and Oakley at Presence Saints Mary and Elizabeth Medical Center. Come on over and pick up your weekend produce, bread, eggs, meat and more! $3 for $1 SNAP/LINK matching! https://t.co/IDI6gXokyu",NR,"open every, come on over, pick up your",business,
821,"Farmers' markets season in Cape Girardeau kicks off today! The Cape Farmers' Market is open in the Macy's lot at West Park Mall until 5 p.m. today (Thursday). The Cape Riverfront Market starts on Saturday, May 5. https://t.co/Z1Lcm2JASi",NR,"open, kicks off today",business,
822,I’m ready to go to the farmers market,NR,,,
823,@Schwarzenegger How do u cut fish @JapanGov looking for nerves @PutinRF_Eng more clearly veins @HUDgov cook look white @DocYilk food borne illness. Farmers markets systems. Look off film buyers & sellers. Toxicology due because them junkies real junkies trafficking addicts addictions practices©,safety,"food borne illness, toxicology, practices",,
